{
  "scoring": {
    "status": "scored",
    "score": 86,
    "band": "high",
    "model_version": "1.0.0",
    "components": [
      {
        "criterion_id": "farrier.professional_activity",
        "points_awarded": 20,
        "max_points": 20,
        "evidence_ids": [
          "EV-HOME-001",
          "EV-ABOUT-001"
        ],
        "notes": "Full V1 weight awarded for confirmed criterion."
      },
      {
        "criterion_id": "farrier.product_usage_or_influence",
        "points_awarded": 15,
        "max_points": 15,
        "evidence_ids": [
          "EV-GLUE-001"
        ],
        "notes": "Full V1 weight awarded for confirmed criterion."
      },
      {
        "criterion_id": "farrier.product_fit",
        "points_awarded": 10,
        "max_points": 10,
        "evidence_ids": [
          "EV-HOME-001",
          "EV-GLUE-001"
        ],
        "notes": "Full V1 weight awarded for confirmed criterion."
      },
      {
        "criterion_id": "farrier.regular_business_activity",
        "points_awarded": 10,
        "max_points": 10,
        "evidence_ids": [
          "EV-HOME-001",
          "EV-TRAVEL-001",
          "EV-ABOUT-001"
        ],
        "notes": "Full V1 weight awarded for confirmed criterion."
      },
      {
        "criterion_id": "farrier.advanced_specialisation",
        "points_awarded": 8,
        "max_points": 8,
        "evidence_ids": [
          "EV-ABOUT-001",
          "EV-LAMENESS-001",
          "EV-GLUE-001"
        ],
        "notes": "Full V1 weight awarded for confirmed criterion."
      },
      {
        "criterion_id": "farrier.high_value_service_area",
        "points_awarded": 5,
        "max_points": 5,
        "evidence_ids": [
          "EV-TRAVEL-001",
          "EV-CONTACT-001"
        ],
        "notes": "Full V1 weight awarded for confirmed criterion."
      },
      {
        "criterion_id": "farrier.certified_or_experienced",
        "points_awarded": 5,
        "max_points": 5,
        "evidence_ids": [
          "EV-ABOUT-001"
        ],
        "notes": "Full V1 weight awarded for confirmed criterion."
      },
      {
        "criterion_id": "farrier.sport_horse_focus",
        "points_awarded": 5,
        "max_points": 5,
        "evidence_ids": [
          "EV-ABOUT-001",
          "EV-HOME-001"
        ],
        "notes": "Full V1 weight awarded for confirmed criterion."
      },
      {
        "criterion_id": "farrier.buying_influence",
        "points_awarded": 5,
        "max_points": 5,
        "evidence_ids": [
          "EV-GLUE-001",
          "EV-HOME-001"
        ],
        "notes": "Full V1 weight awarded for confirmed criterion."
      },
      {
        "criterion_id": "farrier.engagement_signal",
        "points_awarded": 3,
        "max_points": 3,
        "evidence_ids": [
          "EV-ABOUT-001",
          "EV-CONTACT-001"
        ],
        "notes": "Full V1 weight awarded for confirmed criterion."
      }
    ],
    "rationale": "Numeric ICP score 86/100 from 10 confirmed weighted criteria. Raw band high; final band high.",
    "block_reason": null
  },
  "audit": {
    "raw_band": "high",
    "final_band": "high",
    "applied_band_caps": [],
    "outcome": "high_priority_farrier",
    "review_required": true,
    "confirmed_positive_criteria": [
      "farrier.professional_activity",
      "farrier.product_usage_or_influence",
      "farrier.product_fit",
      "farrier.regular_business_activity",
      "farrier.advanced_specialisation",
      "farrier.high_value_service_area",
      "farrier.certified_or_experienced",
      "farrier.sport_horse_focus",
      "farrier.buying_influence",
      "farrier.engagement_signal"
    ],
    "missing_required_gates": []
  },
  "explanation": {
    "summary": "ICP score 86/100; final band high. 10 weighted criteria earned points. Outcome: high_priority_farrier.",
    "confirmed_criteria": [
      {
        "criterion_id": "farrier.professional_activity",
        "points": 20,
        "evidence_ids": [
          "EV-HOME-001",
          "EV-ABOUT-001"
        ]
      },
      {
        "criterion_id": "farrier.product_usage_or_influence",
        "points": 15,
        "evidence_ids": [
          "EV-GLUE-001"
        ]
      },
      {
        "criterion_id": "farrier.product_fit",
        "points": 10,
        "evidence_ids": [
          "EV-HOME-001",
          "EV-GLUE-001"
        ]
      },
      {
        "criterion_id": "farrier.regular_business_activity",
        "points": 10,
        "evidence_ids": [
          "EV-HOME-001",
          "EV-TRAVEL-001",
          "EV-ABOUT-001"
        ]
      },
      {
        "criterion_id": "farrier.advanced_specialisation",
        "points": 8,
        "evidence_ids": [
          "EV-ABOUT-001",
          "EV-LAMENESS-001",
          "EV-GLUE-001"
        ]
      },
      {
        "criterion_id": "farrier.high_value_service_area",
        "points": 5,
        "evidence_ids": [
          "EV-TRAVEL-001",
          "EV-CONTACT-001"
        ]
      },
      {
        "criterion_id": "farrier.certified_or_experienced",
        "points": 5,
        "evidence_ids": [
          "EV-ABOUT-001"
        ]
      },
      {
        "criterion_id": "farrier.sport_horse_focus",
        "points": 5,
        "evidence_ids": [
          "EV-ABOUT-001",
          "EV-HOME-001"
        ]
      },
      {
        "criterion_id": "farrier.buying_influence",
        "points": 5,
        "evidence_ids": [
          "EV-GLUE-001",
          "EV-HOME-001"
        ]
      },
      {
        "criterion_id": "farrier.engagement_signal",
        "points": 3,
        "evidence_ids": [
          "EV-ABOUT-001",
          "EV-CONTACT-001"
        ]
      }
    ],
    "unearned_weighted_criteria": [
      "farrier.established_client_base",
      "farrier.multi_farrier_business"
    ],
    "applied_band_rules": [],
    "outcome": "high_priority_farrier",
    "review_required": true,
    "confidence_interpretation": "High commercial fit with High evidence confidence: attractive and well-supported for human review."
  },
  "confidence_context": {
    "level": "high",
    "score": 84,
    "method_version": "evidence-confidence-1.0.0"
  }
}
